{
  "$schema": "https://json-schema.org/draft/2020-12/schema",
  "$id": "https://project-42.dev/schemas/contributors/contributor-credit-package-1.0.json",
  "title": "Project 42 contributor-credit package",
  "type": "object",
  "additionalProperties": false,
  "required": [
    "schemaVersion",
    "id",
    "createdAt",
    "content",
    "repository",
    "acceptedChange",
    "credits"
  ],
  "properties": {
    "schemaVersion": { "const": "1.0" },
    "id": { "$ref": "#/$defs/stableId" },
    "createdAt": { "$ref": "#/$defs/timestamp" },
    "content": { "$ref": "#/$defs/content" },
    "repository": { "$ref": "#/$defs/repository" },
    "acceptedChange": { "$ref": "#/$defs/acceptedChange" },
    "credits": {
      "type": "array",
      "minItems": 1,
      "items": { "$ref": "#/$defs/credit" }
    }
  },
  "$defs": {
    "stableId": {
      "type": "string",
      "pattern": "^[A-Za-z0-9][A-Za-z0-9._:-]{2,255}$"
    },
    "timestamp": {
      "type": "string",
      "pattern": "^\\d{4}-\\d{2}-\\d{2}T\\d{2}:\\d{2}:\\d{2}(?:\\.\\d{3})?Z$"
    },
    "httpsUrl": {
      "type": "string",
      "pattern": "^https://"
    },
    "digest": {
      "type": "string",
      "pattern": "^[a-f0-9]{64}$"
    },
    "commit": {
      "type": "string",
      "pattern": "^(?:[a-f0-9]{40}|[a-f0-9]{64})$"
    },
    "content": {
      "type": "object",
      "additionalProperties": false,
      "required": ["contentId", "contentKind", "acceptedVersion"],
      "properties": {
        "contentId": { "$ref": "#/$defs/stableId" },
        "contentKind": {
          "enum": [
            "learn-module",
            "field-guide-resource",
            "training-package"
          ]
        },
        "acceptedVersion": {
          "type": "string",
          "pattern": "^[A-Za-z0-9][A-Za-z0-9._+-]{0,127}$"
        }
      }
    },
    "repository": {
      "type": "object",
      "additionalProperties": false,
      "required": ["provider", "repositoryId", "repositoryUrl"],
      "properties": {
        "provider": { "$ref": "#/$defs/stableId" },
        "repositoryId": {
          "type": "string",
          "pattern": "^[A-Za-z0-9][A-Za-z0-9._:/-]{2,255}$"
        },
        "repositoryUrl": { "$ref": "#/$defs/httpsUrl" }
      }
    },
    "acceptedChange": {
      "type": "object",
      "additionalProperties": false,
      "required": [
        "pullRequestId",
        "pullRequestUrl",
        "mergedAt",
        "mergeCommitSha",
        "acceptedCommitSha"
      ],
      "properties": {
        "pullRequestId": {
          "type": "string",
          "minLength": 1,
          "maxLength": 120
        },
        "pullRequestUrl": { "$ref": "#/$defs/httpsUrl" },
        "mergedAt": { "$ref": "#/$defs/timestamp" },
        "mergeCommitSha": { "$ref": "#/$defs/commit" },
        "acceptedCommitSha": { "$ref": "#/$defs/commit" }
      }
    },
    "contributor": {
      "type": "object",
      "additionalProperties": false,
      "required": [
        "contributorRef",
        "provider",
        "providerAccountRef",
        "identityProofDigest",
        "accountState"
      ],
      "properties": {
        "contributorRef": { "$ref": "#/$defs/stableId" },
        "provider": { "$ref": "#/$defs/stableId" },
        "providerAccountRef": {
          "type": ["string", "null"],
          "minLength": 1,
          "maxLength": 255
        },
        "identityProofDigest": { "$ref": "#/$defs/digest" },
        "accountState": { "enum": ["active", "deleted"] }
      }
    },
    "consent": {
      "type": "object",
      "additionalProperties": false,
      "required": ["status", "recordedAt", "revokedAt"],
      "properties": {
        "status": { "enum": ["granted", "not-granted", "revoked"] },
        "recordedAt": { "$ref": "#/$defs/timestamp" },
        "revokedAt": {
          "oneOf": [
            { "$ref": "#/$defs/timestamp" },
            { "type": "null" }
          ]
        }
      },
      "allOf": [
        {
          "if": {
            "properties": { "status": { "const": "revoked" } },
            "required": ["status"]
          },
          "then": {
            "properties": {
              "revokedAt": { "$ref": "#/$defs/timestamp" }
            }
          },
          "else": {
            "properties": { "revokedAt": { "type": "null" } }
          }
        }
      ]
    },
    "publicProfile": {
      "type": "object",
      "additionalProperties": false,
      "required": ["displayName", "profileUrl"],
      "properties": {
        "displayName": {
          "type": "string",
          "minLength": 1,
          "maxLength": 120,
          "not": {
            "type": "string",
            "pattern": "[A-Za-z0-9._%+-]+@[A-Za-z0-9.-]+\\.[A-Za-z]{2,}"
          }
        },
        "profileUrl": {
          "oneOf": [
            {
              "allOf": [
                { "$ref": "#/$defs/httpsUrl" },
                {
                  "not": {
                    "type": "string",
                    "pattern": "[A-Za-z0-9._%+-]+@[A-Za-z0-9.-]+\\.[A-Za-z]{2,}"
                  }
                }
              ]
            },
            { "type": "null" }
          ]
        }
      }
    },
    "aiAssistance": {
      "type": "object",
      "additionalProperties": false,
      "required": ["used", "disclosure", "humanAccountabilityAccepted"],
      "properties": {
        "used": { "type": "boolean" },
        "disclosure": {
          "type": ["string", "null"],
          "minLength": 1,
          "maxLength": 500,
          "not": {
            "type": "string",
            "pattern": "[A-Za-z0-9._%+-]+@[A-Za-z0-9.-]+\\.[A-Za-z]{2,}"
          }
        },
        "humanAccountabilityAccepted": { "const": true }
      },
      "allOf": [
        {
          "if": {
            "properties": { "used": { "const": true } },
            "required": ["used"]
          },
          "then": {
            "properties": {
              "disclosure": {
                "type": "string",
                "minLength": 1,
                "maxLength": 500,
                "not": {
                  "type": "string",
                  "pattern": "[A-Za-z0-9._%+-]+@[A-Za-z0-9.-]+\\.[A-Za-z]{2,}"
                }
              }
            }
          },
          "else": {
            "properties": { "disclosure": { "type": "null" } }
          }
        }
      ]
    },
    "credit": {
      "type": "object",
      "additionalProperties": false,
      "required": [
        "id",
        "role",
        "contributor",
        "consent",
        "publicProfile",
        "contributionSummary",
        "aiAssistance"
      ],
      "properties": {
        "id": { "$ref": "#/$defs/stableId" },
        "role": {
          "enum": [
            "author",
            "reviewer",
            "subject-matter-expert",
            "accessibility-reviewer"
          ]
        },
        "contributor": { "$ref": "#/$defs/contributor" },
        "consent": { "$ref": "#/$defs/consent" },
        "publicProfile": {
          "oneOf": [
            { "$ref": "#/$defs/publicProfile" },
            { "type": "null" }
          ]
        },
        "contributionSummary": {
          "type": "string",
          "minLength": 1,
          "maxLength": 500,
          "not": {
            "type": "string",
            "pattern": "[A-Za-z0-9._%+-]+@[A-Za-z0-9.-]+\\.[A-Za-z]{2,}"
          }
        },
        "aiAssistance": { "$ref": "#/$defs/aiAssistance" }
      },
      "allOf": [
        {
          "if": {
            "properties": {
              "contributor": {
                "type": "object",
                "properties": { "accountState": { "const": "deleted" } },
                "required": ["accountState"]
              }
            },
            "required": ["contributor"]
          },
          "then": {
            "properties": {
              "contributor": {
                "type": "object",
                "properties": {
                  "providerAccountRef": { "type": "null" }
                }
              },
              "publicProfile": { "type": "null" }
            }
          },
          "else": {
            "properties": {
              "contributor": {
                "type": "object",
                "properties": {
                  "providerAccountRef": {
                    "type": "string",
                    "minLength": 1,
                    "maxLength": 255
                  }
                }
              }
            }
          }
        },
        {
          "if": {
            "properties": {
              "contributor": {
                "type": "object",
                "properties": { "accountState": { "const": "active" } },
                "required": ["accountState"]
              },
              "consent": {
                "type": "object",
                "properties": { "status": { "const": "granted" } },
                "required": ["status"]
              }
            },
            "required": ["contributor", "consent"]
          },
          "then": {
            "properties": {
              "publicProfile": { "$ref": "#/$defs/publicProfile" }
            }
          },
          "else": {
            "properties": { "publicProfile": { "type": "null" } }
          }
        }
      ]
    }
  }
}
