{
  "schemaVersion": "1.0",
  "id": "credit.ai-assisted-production.1",
  "createdAt": "2026-07-28T14:00:00.000Z",
  "content": {
    "contentId": "ai-foundations.language-models-and-generation",
    "contentKind": "learn-module",
    "acceptedVersion": "1.4.0"
  },
  "repository": {
    "provider": "github",
    "repositoryId": "project42dev/project42-platform",
    "repositoryUrl": "https://github.com/project42dev/project42-platform"
  },
  "acceptedChange": {
    "pullRequestId": "91",
    "pullRequestUrl": "https://github.com/project42dev/project42-platform/pull/91",
    "mergedAt": "2026-07-28T13:45:00.000Z",
    "mergeCommitSha": "1111111111111111111111111111111111111111",
    "acceptedCommitSha": "2222222222222222222222222222222222222222"
  },
  "credits": [
    {
      "id": "credit.author.primary",
      "role": "author",
      "contributor": {
        "contributorRef": "contributor.2fb3652c",
        "provider": "github",
        "providerAccountRef": "github-account-1001",
        "identityProofDigest": "aaaaaaaaaaaaaaaaaaaaaaaaaaaaaaaaaaaaaaaaaaaaaaaaaaaaaaaaaaaaaaaa",
        "accountState": "active"
      },
      "consent": {
        "status": "granted",
        "recordedAt": "2026-07-27T16:00:00.000Z",
        "revokedAt": null
      },
      "publicProfile": {
        "displayName": "Project 42 contributor",
        "profileUrl": "https://github.com/project42-contributor"
      },
      "contributionSummary": "Authored and verified the accepted lesson revision.",
      "aiAssistance": {
        "used": true,
        "disclosure": "AI assisted drafting; the credited author reviewed sources, corrected the work, and accepted accountability.",
        "humanAccountabilityAccepted": true
      }
    }
  ]
}
